### ISSUE TITLE
Can we optimize OkHttp retry behavior to reduce CPU usage?

### ISSUE THREAD

**Issue by RunWang123** [GrakovNe/lissen-android#227]
## Current Observation
Our performance monitoring system detected some CPU usage could be improved for this app. This seems to be happening when network requests fail, causing endless retry attempts..
Sample output
00:09:13.344420 IP 10.1.10.1.36144 > 64.227.67.182.https: Flags [S], seq 3512361604, win 65535, options [mss 1460,sackOK,TS val 1658600901 ecr 0,nop,wscale 8], length 0
00:09:14.361928 IP 10.1.10.1.36144 > 64.227.67.182.https: Flags [S], seq 3512361604, win 65535, options [mss 1460,sackOK,TS val 1658601918 ecr 0,nop,wscale 8], length 0
00:09:16.378073 IP 10.1.10.1.36144 > 64.227.67.182.https: Flags [S], seq 3512361604, win 65535, options [mss 1460,sackOK,TS val 1658603934 ecr 0,nop,wscale 8], length 0
00:09:20.601929 IP 10.1.10.1.36144 > 64.227.67.182.https: Flags [S], seq 3512361604, win 65535, options [mss 1460,sackOK,TS val 1658608158 ecr 0,nop,wscale 8], length 0
00:09:28.793831 IP 10.1.10.1.36144 > 64.227.67.182.https: Flags [S], seq 3512361604, win 65535, options [mss 1460,sackOK,TS val 1658616350 ecr 0,nop,wscale 8], length 0
00:09:40.148165 IP 10.1.10.1.40540 > 64.227.67.182.https: Flags [S], seq 298205611, win 65535, options [mss 1460,sackOK,TS val 1658627704 ecr 0,nop,wscale 8], length 0
00:09:41.177875 IP 10.1.10.1.40540 > 64.227.67.182.https: Flags [S], seq 298205611, win 65535, options [mss 1460,sackOK,TS val 1658628734 ecr 0,nop,wscale 8], length 0
00:09:43.193903 IP 10.1.10.1.40540 > 64.227.67.182.https: Flags [S], seq 298205611, win 65535, options [mss 1460,sackOK,TS val 1658630750 ecr 0,nop,wscale 8], length 0
00:09:47.225873 IP 10.1.10.1.40540 > 64.227.67.182.https: Flags [S], seq 298205611, win 65535, options [mss 1460,sackOK,TS val 1658634782 ecr 0,nop,wscale 8], length 0
00:09:55.418209 IP 10.1.10.1.40540 > 64.227.67.182.https: Flags [S], seq 298205611, win 65535, options [mss 1460,sackOK,TS val 1658642974 ecr 0,nop,wscale 8], length 0
00:10:10.161719 IP 10.1.10.1.57056 > 64.227.67.182.https: Flags [S], seq 2650803339, win 65535, options [mss 1460,sackOK,TS val 1658657718 ecr 0,nop,wscale 8], length 0
00:10:11.194132 IP 10.1.10.1.57056 > 64.227.67.182.https: Flags [S], seq 2650803339, win 65535, options [mss 1460,sackOK,TS val 1658658750 ecr 0,nop,wscale 8], length 0
00:10:13.209901 IP 10.1.10.1.57056 > 64.227.67.182.https: Flags [S], seq 2650803339, win 65535, options [mss 1460,sackOK,TS val 1658660766 ecr 0,nop,wscale 8], length 0
00:10:17.434010 IP 10.1.10.1.57056 > 64.227.67.182.https: Flags [S], seq 2650803339, win 65535, options [mss 1460,sackOK,TS val 1658664990 ecr 0,nop,wscale 8], length 0
00:10:25.625869 IP 10.1.10.1.57056 > 64.227.67.182.https: Flags [S], seq 2650803339, win 65535, options [mss 1460,sackOK,TS val 1658673182 ecr 0,nop,wscale 8], length 0
00:10:40.389052 IP 10.1.10.1.50306 > 64.227.67.182.https: Flags [S], seq 1418834472, win 65535, options [mss 1460,sackOK,TS val 1658687945 ecr 0,nop,wscale 8], length 0
00:10:41.401772 IP 10.1.10.1.50306 > 64.227.67.182.https: Flags [S], seq 1418834472, win 65535, options [mss 1460,sackOK,TS val 1658688958 ecr 0,nop,wscale 8], length 0
00:10:43.417837 IP 10.1.10.1.50306 > 64.227.67.182.https: Flags [S], seq 1418834472, win 65535, options [mss 1460,sackOK,TS val 1658690974 ecr 0,nop,wscale 8], length 0
00:10:47.641829 IP 10.1.10.1.50306 > 64.227.67.182.https: Flags [S], seq 1418834472, win 65535, options [mss 1460,sackOK,TS val 1658695198 ecr 0,nop,wscale 8], length 0
00:10:55.833740 IP 10.1.10.1.50306 > 64.227.67.182.https: Flags [S], seq 1418834472, win 65535, options [mss 1460,sackOK,TS val 1658703390 ecr 0,nop,wscale 8], length 0
00:11:10.392398 IP 10.1.10.1.53668 > 64.227.67.182.https: Flags [S], seq 250368252, win 65535, options [mss 1460,sackOK,TS val 1658717949 ecr 0,nop,wscale 8], length 0
00:11:11.418009 IP 10.1.10.1.53668 > 64.227.67.182.https: Flags [S], seq 250368252, win 65535, options [mss 1460,sackOK,TS val 1658718974 ecr 0,nop,wscale 8], length 0
00:11:13.433950 IP 10.1.10.1.53668 > 64.227.67.182.https: Flags [S], seq 250368252, win 65535, options [mss 1460,sackOK,TS val 1658720990 ecr 0,nop,wscale 8], length 0
00:11:17.594207 IP 10.1.10.1.53668 > 64.227.67.182.https: Flags [S], seq 250368252, win 65535, options [mss 1460,sackOK,TS val 1658725150 ecr 0,nop,wscale 8], length 0
00:11:25.786157 IP 10.1.10.1.53668 > 64.227.67.182.https: Flags [S], seq 250368252, win 65535, options [mss 1460,sackOK,TS val 1658733342 ecr 0,nop,wscale 8], length 0
00:11:40.240505 IP 10.1.10.1.33554 > 64.227.67.182.https: Flags [S], seq 1098719273, win 65535, options [mss 1460,sackOK,TS val 1658747797 ecr 0,nop,wscale 8], length 0
00:11:41.241750 IP 10.1.10.1.33554 > 64.227.67.182.https: Flags [S], seq 1098719273, win 65535, options [mss 1460,sackOK,TS val 1658748798 ecr 0,nop,wscale 8], length 0
00:11:43.257584 IP 10.1.10.1.33554 > 64.227.67.182.https: Flags [S], seq 1098719273, win 65535, options [mss 1460,sackOK,TS val 1658750814 ecr 0,nop,wscale 8], length 0
00:11:47.289989 IP 10.1.10.1.33554 > 64.227.67.182.https: Flags [S], seq 1098719273, win 65535, options [mss 1460,sackOK,TS val 1658754846 ecr 0,nop,wscale 8], length 0
00:11:55.482104 IP 10.1.10.1.33554 > 64.227.67.182.https: Flags [S], seq 1098719273, win 65535, options [mss 1460,sackOK,TS val 1658763038 ecr 0,nop,wscale 8], length 0
00:12:10.191341 IP 10.1.10.1.32822 > 64.227.67.182.https: Flags [S], seq 1161942403, win 65535, options [mss 1460,sackOK,TS val 1658777748 ecr 0,nop,wscale 8], length 0
00:12:11.193468 IP 10.1.10.1.32822 > 64.227.67.182.https: Flags [S], seq 1161942403, win 65535, options [mss 1460,sackOK,TS val 1658778750 ecr 0,nop,wscale 8], length 0
00:12:13.210342 IP 10.1.10.1.32822 > 64.227.67.182.https: Flags [S], seq 1161942403, win 65535, options [mss 1460,sackOK,TS val 1658780766 ecr 0,nop,wscale 8], length 0
00:12:17.241896 IP 10.1.10.1.32822 > 64.227.67.182.https: Flags [S], seq 1161942403, win 65535, options [mss 1460,sackOK,TS val 1658784798 ecr 0,nop,wscale 8], length 0
00:12:25.434235 IP 10.1.10.1.32822 > 64.227.67.182.https: Flags [S], seq 1161942403, win 65535, options [mss 1460,sackOK,TS val 1658792990 ecr 0,nop,wscale 8], length 0
00:12:40.194383 IP 10.1.10.1.58386 > 64.227.67.182.https: Flags [S], seq 3053695928, win 65535, options [mss 1460,sackOK,TS val 1658807751 ecr 0,nop,wscale 8], length 0
00:12:41.209825 IP 10.1.10.1.58386 > 64.227.67.182.https: Flags [S], seq 3053695928, win 65535, options [mss 1460,sackOK,TS val 1658808766 ecr 0,nop,wscale 8], length 0
00:12:43.225868 IP 10.1.10.1.58386 > 64.227.67.182.https: Flags [S], seq 3053695928, win 65535, options [mss 1460,sackOK,TS val 1658810782 ecr 0,nop,wscale 8], length 0
00:12:47.450211 IP 10.1.10.1.58386 > 64.227.67.182.https: Flags [S], seq 3053695928, win 65535, options [mss 1460,sackOK,TS val 1658815006 ecr 0,nop,wscale 8], length 0
00:12:55.641991 IP 10.1.10.1.58386 > 64.227.67.182.https: Flags [S], seq 3053695928, win 65535, options [mss 1460,sackOK,TS val 1658823198 ecr 0,nop,wscale 8], length 0
00:13:10.300000 IP 10.1.10.1.53916 > 64.227.67.182.https: Flags [S], seq 2707688172, win 65535, options [mss 1460,sackOK,TS val 1658837856 ecr 0,nop,wscale 8], length 0
00:13:11.322055 IP 10.1.10.1.53916 > 64.227.67.182.https: Flags [S], seq 2707688172, win 65535, options [mss 1460,sackOK,TS val 1658838878 ecr 0,nop,wscale 8], length 0
00:13:13.337865 IP 10.1.10.1.53916 > 64.227.67.182.https: Flags [S], seq 2707688172, win 65535, options [mss 1460,sackOK,TS val 1658840894 ecr 0,nop,wscale 8], length 0
00:13:17.402240 IP 10.1.10.1.53916 > 64.227.67.182.https: Flags [S], seq 2707688172, win 65535, options [mss 1460,sackOK,TS val 1658844958 ecr 0,nop,wscale 8], length 0
00:13:25.594115 IP 10.1.10.1.53916 > 64.227.67.182.https: Flags [S], seq 2707688172, win 65535, options [mss 1460,sackOK,TS val 1658853150 ecr 0,nop,wscale 8], length 0
00:13:40.193672 IP 10.1.10.1.43630 > 64.227.67.182.https: Flags [S], seq 2776067898, win 65535, options [mss 1460,sackOK,TS val 1658867750 ecr 0,nop,wscale 8], length 0
00:13:41.209740 IP 10.1.10.1.43630 > 64.227.67.182.https: Flags [S], seq 2776067898, win 65535, options [mss 1460,sackOK,TS val 1658868766 ecr 0,nop,wscale 8], length 0
00:13:43.225991 IP 10.1.10.1.43630 > 64.227.67.182.https: Flags [S], seq 2776067898, win 65535, options [mss 1460,sackOK,TS val 1658870782 ecr 0,nop,wscale 8], length 0
00:13:47.353890 IP 10.1.10.1.43630 > 64.227.67.182.https: Flags [S], seq 2776067898, win 65535, options [mss 1460,sackOK,TS val 1658874910 ecr 0,nop,wscale 8], length 0
00:13:55.546233 IP 10.1.10.1.43630 > 64.227.67.182.https: Flags [S], seq 2776067898, win 65535, options [mss 1460,sackOK,TS val 1658883102 ecr 0,nop,wscale 8], length 0
00:14:10.357412 IP 10.1.10.1.54158 > 64.227.67.182.https: Flags [S], seq 2727370398, win 65535, options [mss 1460,sackOK,TS val 1658897914 ecr 0,nop,wscale 8], length 0
00:14:11.385943 IP 10.1.10.1.54158 > 64.227.67.182.https: Flags [S], seq 2727370398, win 65535, options [mss 1460,sackOK,TS val 1658898942 ecr 0,nop,wscale 8], length 0
00:14:13.405468 IP 10.1.10.1.54158 > 64.227.67.182.https: Flags [S], seq 2727370398, win 65535, options [mss 1460,sackOK,TS val 1658900962 ecr 0,nop,wscale 8], length 0
00:14:17.562130 IP 10.1.10.1.54158 > 64.227.67.182.https: Flags [S], seq 2727370398, win 65535, options [mss 1460,sackOK,TS val 1658905118 ecr 0,nop,wscale 8], length 0
00:14:25.753950 IP 10.1.10.1.54158 > 64.227.67.182.https: Flags [S], seq 2727370398, win 65535, options [mss 1460,sackOK,TS val 1658913310 ecr 0,nop,wscale 8], length 0
00:14:40.202338 IP 10.1.10.1.38088 > 64.227.67.182.https: Flags [S], seq 3559849786, win 65535, options [mss 1460,sackOK,TS val 1658927759 ecr 0,nop,wscale 8], length 0
00:14:41.209844 IP 10.1.10.1.38088 > 64.227.67.182.https: Flags [S], seq 3559849786, win 65535, options [mss 1460,sackOK,TS val 1658928766 ecr 0,nop,wscale 8], length 0
00:14:43.225777 IP 10.1.10.1.38088 > 64.227.67.182.https: Flags [S], seq 3559849786, win 65535, options [mss 1460,sackOK,TS val 1658930782 ecr 0,nop,wscale 8], length 0
00:14:47.257961 IP 10.1.10.1.38088 > 64.227.67.182.https: Flags [S], seq 3559849786, win 65535, options [mss 1460,sackOK,TS val 1658934814 ecr 0,nop,wscale 8], length 0
00:14:55.450125 IP 10.1.10.1.38088 > 64.227.67.182.https: Flags [S], seq 3559849786, win 65535, options [mss 1460,sackOK,TS val 1658943006 ecr 0,nop,wscale 8], length 0
00:15:10.418882 IP 10.1.10.1.58410 > 64.227.67.182.https: Flags [S], seq 1910428837, win 65535, options [mss 1460,sackOK,TS val 1658957975 ecr 0,nop,wscale 8], length 0
00:15:11.449652 IP 10.1.10.1.58410 > 64.227.67.182.https: Flags [S], seq 1910428837, win 65535, options [mss 1460,sackOK,TS val 1658959006 ecr 0,nop,wscale 8], length 0
00:15:13.465969 IP 10.1.10.1.58410 > 64.227.67.182.https: Flags [S], seq 1910428837, win 65535, options [mss 1460,sackOK,TS val 1658961022 ecr 0,nop,wscale 8], length 0
00:15:17.721971 IP 10.1.10.1.58410 > 64.227.67.182.https: Flags [S], seq 1910428837, win 65535, options [mss 1460,sackOK,TS val 1658965278 ecr 0,nop,wscale 8], length 0
00:15:25.913875 IP 10.1.10.1.58410 > 64.227.67.182.https: Flags [S], seq 1910428837, win 65535, options [mss 1460,sackOK,TS val 1658973470 ecr 0,nop,wscale 8], length 0
00:15:40.195350 IP 10.1.10.1.43268 > 64.227.67.182.https: Flags [S], seq 1034066900, win 65535, options [mss 1460,sackOK,TS val 1658987752 ecr 0,nop,wscale 8], length 0
00:15:41.210220 IP 10.1.10.1.43268 > 64.227.67.182.https: Flags [S], seq 1034066900, win 65535, options [mss 1460,sackOK,TS val 1658988766 ecr 0,nop,wscale 8], length 0
00:15:43.225765 IP 10.1.10.1.43268 > 64.227.67.182.https: Flags [S], seq 1034066900, win 65535, options [mss 1460,sackOK,TS val 1658990782 ecr 0,nop,wscale 8], length 0
00:15:47.417854 IP 10.1.10.1.43268 > 64.227.67.182.https: Flags [S], seq 1034066900, win 65535, options [mss 1460,sackOK,TS val 1658994974 ecr 0,nop,wscale 8], length 0
00:15:55.609537 IP 10.1.10.1.43268 > 64.227.67.182.https: Flags [S], seq 1034066900, win 65535, options [mss 1460,sackOK,TS val 1659003166 ecr 0,nop,wscale 8], length 0
00:16:10.250055 IP 10.1.10.1.38162 > 64.227.67.182.https: Flags [S], seq 2838445181, win 65535, options [mss 1460,sackOK,TS val 1659017806 ecr 0,nop,wscale 8], length 0
00:16:11.257329 IP 10.1.10.1.38162 > 64.227.67.182.https: Flags [S], seq 2838445181, win 65535, options [mss 1460,sackOK,TS val 1659018814 ecr 0,nop,wscale 8], length 0
00:16:13.273866 IP 10.1.10.1.38162 > 64.227.67.182.https: Flags [S], seq 2838445181, win 65535, options [mss 1460,sackOK,TS val 1659020830 ecr 0,nop,wscale 8], length 0
00:16:17.369910 IP 10.1.10.1.38162 > 64.227.67.182.https: Flags [S], seq 2838445181, win 65535, options [mss 1460,sackOK,TS val 1659024926 ecr 0,nop,wscale 8], length 0
00:16:25.561376 IP 10.1.10.1.38162 > 64.227.67.182.https: Flags [S], seq 2838445181, win 65535, options [mss 1460,sackOK,TS val 1659033118 ecr 0,nop,wscale 8], length 0
00:16:40.432191 IP 10.1.10.1.59882 > 64.227.67.182.https: Flags [S], seq 2415031449, win 65535, options [mss 1460,sackOK,TS val 1659047989 ecr 0,nop,wscale 8], length 0
00:16:41.433233 IP 10.1.10.1.59882 > 64.227.67.182.https: Flags [S], seq 2415031449, win 65535, options [mss 1460,sackOK,TS val 1659048990 ecr 0,nop,wscale 8], length 0
00:16:43.449606 IP 10.1.10.1.59882 > 64.227.67.182.https: Flags [S], seq 2415031449, win 65535, options [mss 1460,sackOK,TS val 1659051006 ecr 0,nop,wscale 8], length 0
00:16:47.581374 IP 10.1.10.1.59882 > 64.227.67.182.https: Flags [S], seq 2415031449, win 65535, options [mss 1460,sackOK,TS val 1659055138 ecr 0,nop,wscale 8], length 0
00:16:55.769851 IP 10.1.10.1.59882 > 64.227.67.182.https: Flags [S], seq 2415031449, win 65535, options [mss 1460,sackOK,TS val 1659063326 ecr 0,nop,wscale 8], length 0
00:17:10.435066 IP 10.1.10.1.48920 > 64.227.67.182.https: Flags [S], seq 1090956151, win 65535, options [mss 1460,sackOK,TS val 1659077991 ecr 0,nop,wscale 8], length 0
00:17:11.449994 IP 10.1.10.1.48920 > 64.227.67.182.https: Flags [S], seq 1090956151, win 65535, options [mss 1460,sackOK,TS val 1659079006 ecr 0,nop,wscale 8], length 0
00:17:13.465935 IP 10.1.10.1.48920 > 64.227.67.182.https: Flags [S], seq 1090956151, win 65535, options [mss 1460,sackOK,TS val 1659081022 ecr 0,nop,wscale 8], length 0
00:17:17.529927 IP 10.1.10.1.48920 > 64.227.67.182.https: Flags [S], seq 1090956151, win 65535, options [mss 1460,sackOK,TS val 1659085086 ecr 0,nop,wscale 8], length 0
00:17:25.721962 IP 10.1.10.1.48920 > 64.227.67.182.https: Flags [S], seq 1090956151, win 65535, options [mss 1460,sackOK,TS val 1659093278 ecr 0,nop,wscale 8], length 0
00:17:40.203926 IP 10.1.10.1.51784 > 64.227.67.182.https: Flags [S], seq 80164075, win 65535, options [mss 1460,sackOK,TS val 1659107760 ecr 0,nop,wscale 8], length 0
00:17:41.210177 IP 10.1.10.1.51784 > 64.227.67.182.https: Flags [S], seq 80164075, win 65535, options [mss 1460,sackOK,TS val 1659108766 ecr 0,nop,wscale 8], length 0
00:17:43.225479 IP 10.1.10.1.51784 > 64.227.67.182.https: Flags [S], seq 80164075, win 65535, options [mss 1460,sackOK,TS val 1659110782 ecr 0,nop,wscale 8], length 0
00:17:47.482270 IP 10.1.10.1.51784 > 64.227.67.182.https: Flags [S], seq 80164075, win 65535, options [mss 1460,sackOK,TS val 1659115038 ecr 0,nop,wscale 8], length 0
00:17:55.673640 IP 10.1.10.1.51784 > 64.227.67.182.https: Flags [S], seq 80164075, win 65535, options [mss 1460,sackOK,TS val 1659123230 ecr 0,nop,wscale 8], length 0
00:18:10.442269 IP 10.1.10.1.46170 > 64.227.67.182.https: Flags [S], seq 566097627, win 65535, options [mss 1460,sackOK,TS val 1659137999 ecr 0,nop,wscale 8], length 0
00:18:11.449798 IP 10.1.10.1.46170 > 64.227.67.182.https: Flags [S], seq 566097627, win 65535, options [mss 1460,sackOK,TS val 1659139006 ecr 0,nop,wscale 8], length 0
00:18:13.466157 IP 10.1.10.1.46170 > 64.227.67.182.https: Flags [S], seq 566097627, win 65535, options [mss 1460,sackOK,TS val 1659141022 ecr 0,nop,wscale 8], length 0
00:18:17.689823 IP 10.1.10.1.46170 > 64.227.67.182.https: Flags [S], seq 566097627, win 65535, options [mss 1460,sackOK,TS val 1659145246 ecr 0,nop,wscale 8], length 0
00:18:25.881603 IP 10.1.10.1.46170 > 64.227.67.182.https: Flags [S], seq 566097627, win 65535, options [mss 1460,sackOK,TS val 1659153438 ecr 0,nop,wscale 8], length 0
00:18:40.242275 IP 10.1.10.1.48766 > 64.227.67.182.https: Flags [S], seq 106783273, win 65535, options [mss 1460,sackOK,TS val 1659167799 ecr 0,nop,wscale 8], length 0
00:18:41.273770 IP 10.1.10.1.48766 > 64.227.67.182.https: Flags [S], seq 106783273, win 65535, options [mss 1460,sackOK,TS val 1659168830 ecr 0,nop,wscale 8], length 0
00:18:43.290023 IP 10.1.10.1.48766 > 64.227.67.182.https: Flags [S], seq 106783273, win 65535, options [mss 1460,sackOK,TS val 1659170846 ecr 0,nop,wscale 8], length 0
00:18:47.385975 IP 10.1.10.1.48766 > 64.227.67.182.https: Flags [S], seq 106783273, win 65535, options [mss 1460,sackOK,TS val 1659174942 ecr 0,nop,wscale 8], length 0
00:18:55.577818 IP 10.1.10.1.48766 > 64.227.67.182.https: Flags [S], seq 106783273, win 65535, options [mss 1460,sackOK,TS val 1659183134 ecr 0,nop,wscale 8], length 0
00:19:10.451083 IP 10.1.10.1.47054 > 64.227.67.182.https: Flags [S], seq 2244734337, win 65535, options [mss 1460,sackOK,TS val 1659198007 ecr 0,nop,wscale 8], length 0
00:19:11.485242 IP 10.1.10.1.47054 > 64.227.67.182.https: Flags [S], seq 2244734337, win 65535, options [mss 1460,sackOK,TS val 1659199042 ecr 0,nop,wscale 8], length 0
00:19:13.501498 IP 10.1.10.1.47054 > 64.227.67.182.https: Flags [S], seq 2244734337, win 65535, options [mss 1460,sackOK,TS val 1659201058 ecr 0,nop,wscale 8], length 0
00:19:17.593762 IP 10.1.10.1.47054 > 64.227.67.182.https: Flags [S], seq 2244734337, win 65535, options [mss 1460,sackOK,TS val 1659205150 ecr 0,nop,wscale 8], length 0
00:19:25.785881 IP 10.1.10.1.47054 > 64.227.67.182.https: Flags [S], seq 2244734337, win 65535, options [mss 1460,sackOK,TS val 1659213342 ecr 0,nop,wscale 8], length 0
00:19:40.350537 IP 10.1.10.1.59820 > 64.227.67.182.https: Flags [S], seq 3803141502, win 65535, options [mss 1460,sackOK,TS val 1659227907 ecr 0,nop,wscale 8], length 0
00:19:41.370065 IP 10.1.10.1.59820 > 64.227.67.182.https: Flags [S], seq 3803141502, win 65535, options [mss 1460,sackOK,TS val 1659228926 ecr 0,nop,wscale 8], length 0
00:19:43.386047 IP 10.1.10.1.59820 > 64.227.67.182.https: Flags [S], seq 3803141502, win 65535, options [mss 1460,sackOK,TS val 1659230942 ecr 0,nop,wscale 8], length 0
00:19:47.545733 IP 10.1.10.1.59820 > 64.227.67.182.https: Flags [S], seq 3803141502, win 65535, options [mss 1460,sackOK,TS val 1659235102 ecr 0,nop,wscale 8], length 0
00:19:55.737710 IP 10.1.10.1.59820 > 64.227.67.182.https: Flags [S], seq 3803141502, win 65535, options [mss 1460,sackOK,TS val 1659243294 ecr 0,nop,wscale 8], length 0
00:20:10.212578 IP 10.1.10.1.36102 > 64.227.67.182.https: Flags [S], seq 1974486870, win 65535, options [mss 1460,sackOK,TS val 1659257769 ecr 0,nop,wscale 8], length 0
00:20:11.225844 IP 10.1.10.1.36102 > 64.227.67.182.https: Flags [S], seq 1974486870, win 65535, options [mss 1460,sackOK,TS val 1659258782 ecr 0,nop,wscale 8], length 0
00:20:13.242230 IP 10.1.10.1.36102 > 64.227.67.182.https: Flags [S], seq 1974486870, win 65535, options [mss 1460,sackOK,TS val 1659260798 ecr 0,nop,wscale 8], length 0
00:20:17.497783 IP 10.1.10.1.36102 > 64.227.67.182.https: Flags [S], seq 1974486870, win 65535, options [mss 1460,sackOK,TS val 1659265054 ecr 0,nop,wscale 8], length 0
00:20:25.689982 IP 10.1.10.1.36102 > 64.227.67.182.https: Flags [S], seq 1974486870, win 65535, options [mss 1460,sackOK,TS val 1659273246 ecr 0,nop,wscale 8], length 0
00:20:40.462217 IP 10.1.10.1.42106 > 64.227.67.182.https: Flags [S], seq 77919503, win 65535, options [mss 1460,sackOK,TS val 1659288019 ecr 0,nop,wscale 8], length 0
00:20:41.465997 IP 10.1.10.1.42106 > 64.227.67.182.https: Flags [S], seq 77919503, win 65535, options [mss 1460,sackOK,TS val 1659289022 ecr 0,nop,wscale 8], length 0
00:20:43.481792 IP 10.1.10.1.42106 > 64.227.67.182.https: Flags [S], seq 77919503, win 65535, options [mss 1460,sackOK,TS val 1659291038 ecr 0,nop,wscale 8], length 0
00:20:47.705876 IP 10.1.10.1.42106 > 64.227.67.182.https: Flags [S], seq 77919503, win 65535, options [mss 1460,sackOK,TS val 1659295262 ecr 0,nop,wscale 8], length 0

### 1. Can we add a controlled retry policy?
```kotlin
class RetryInterceptor(private val maxRetries: Int) : Interceptor {
    override fun intercept(chain: Interceptor.Chain): Response {
        var retryCount = 0
        do {
            try {
                val response = chain.proceed(chain.request())
                if (response.isSuccessful) return response
            } catch (e: IOException) {
                if (retryCount == maxRetries) throw e
                retryCount++
                Thread.sleep((2.0.pow(retryCount.toDouble()) * 1000).toLong()) // Exponential backoff
            }
        } while (retryCount < maxRetries)
        return response
    }
}
```

### 2. Can we adjust retry settings and maybe timeout settings?
```kotlin
.addInterceptor(RetryInterceptor(maxRetries = 3))
.retryOnConnectionFailure(true)
.connectTimeout(60, TimeUnit.SECONDS)  // Currently 30s
.readTimeout(120, TimeUnit.SECONDS)     // Currently 90s
```

## Expected Benefits
- Lower CPU and battery usage
- Better handling of poor network conditions
- More predictable retry behavior

**Comment by GrakovNe** [comment]
Sure, I'll implement it. Many thanks!

**Comment by GrakovNe** [comment]
I've tried the proposed solution, but encountered numerous simultaneous crashes like this:

php
Копировать
Редактировать
Process: org.grakovne.lissen.debug, PID: 4399  
java.lang.RuntimeException: Unknown network error  
    at org.grakovne.lissen.common.RetryInterceptor.intercept(RetryInterceptor.kt:32)  
    at okhttp3.internal.http.RealInterceptorChain.proceed(RealInterceptorChain.kt:109)  
    at org.grakovne.lissen.channel.common.ApiClient$special$$inlined$-addInterceptor$1.intercept(OkHttpClient.kt:1100)  
    at okhttp3.internal.http.RealInterceptorChain.proceed(RealInterceptorChain.kt:109)  
    at okhttp3.logging.HttpLoggingInterceptor.intercept(HttpLoggingInterceptor.kt:154)  
    at okhttp3.internal.http.RealInterceptorChain.proceed(RealInterceptorChain.kt:109)  
    at okhttp3.internal.connection.RealCall.getResponseWithInterceptorChain$okhttp(RealCall.kt:201)  
    at okhttp3.internal.connection.RealCall$AsyncCall.run(RealCall.kt:517)  
    at java.util.concurrent.ThreadPoolExecutor.runWorker(ThreadPoolExecutor.java:1156)  
    at java.util.concurrent.ThreadPoolExecutor$Worker.run(ThreadPoolExecutor.java:651)  
    at java.lang.Thread.run(Thread.java:1119)
ACRA caught a RuntimeException for org.grakovne.lissen.debug:

php
Копировать
Редактировать
java.lang.RuntimeException: Unknown network error  
    at org.grakovne.lissen.common.RetryInterceptor.intercept(RetryInterceptor.kt:32)  
    ...
Between stability and CPU optimization, I choose stability.
Feel free to reopen this issue if you have a more production-ready solution.

**Comment by ulairii** [comment]
I think you use Exoplayer, right? If you have time, maybe you could consider creating a customized exoplayer error handler like this to set a limited retry count:
public final class CustomPolicy
    extends DefaultLoad ErrorHandlingPolicy {

  @Override
  public long getRetryDelayMsFor(
      int dataType,
      long loadDurationMs,
      IOException exception,
      int errorCount) {
    // Replace NoConnectivityException with the corresponding
    // exception for the used DataSource.
    if (exception instanceof NoConnectivityException) {
      return 5000; // Retry every 5 seconds.
    } else {
      return C.TIME_UNSET; // Anything else is surfaced.
    }
  }

  @Override
  public int getMinimumLoadableRetryCount(int dataType) {
    return Integer.MAX_VALUE;
  }
}

Hope Lissen could be a better app.

Thank you.
